user_input,retrieved_contexts,response,reference,faithfulness,answer_relevancy,context_precision
第一、二、三空间的人口数量分别是多少？,"['该小说通过紊乱叙事，解构了技术物化主体的传统叙事', '老刀叹了一口气，横下一条心，觉得事到如今，只好认命。\r\n年长者带他进入一个房间。他发现这是一个旅馆房间，非常大，比秦天的公寓客厅还大，似乎有自己租的房子两倍大。房间的色调是暗沉的金褐色，一张极宽大的双人床摆在中央。床头背后的墙面上是颜色过渡的抽象图案，落地窗，白色半透明纱帘，窗前是一个小圆桌和两张沙发。他心里惴惴。不知道年长者的身份和态度。\r\n“坐吧，坐吧。”年长者拍拍他肩膀，笑笑，“没事了。”\r\n老刀狐疑地看着他。\r\n“你是第三空间来的吧？”年长者把他拉到沙发边上，伸手示意。\r\n“您怎么知道？”老刀无法撒谎。\r\n“从你裤子上。”年长者用手指指他的裤腰，“你那商标还没剪呢。这牌子只有第三空间有卖的。我小时候我妈就喜欢给我爸买这牌子。”\r\n“您是……”\r\n“别您您的，叫你吧。我估摸着我也比你大不了几岁。你今年多大？我五十二。……你看看，就比你大四岁。”他顿了一下，又说，“我叫葛大平，你叫我老葛吧。”\r\n老刀放松了些。老葛把西装脱了，活动了一下膀子，从墙壁里接了一杯热水，递给老刀。他长长的脸，眼角眉梢和两颊都有些下坠，戴一副眼镜，也向下耷拉着，头发有点自来卷，蓬松地堆在头顶，说起话来眉毛一跳一跳，很有喜剧效果。他自己泡了点茶，问老刀要不要，老刀摇摇头。\r\n“我原来也是第三空间的。咱也算半个老乡吧。”老葛说，“所以不用太拘束。我还是能管点事儿，不会把你送出去的。”\r\n老刀长长地出了口气，心里感叹万幸。他于是把自己到第二、第一空间的始末讲了一遍，略去依言感情的细节，只说送到了信，就等着回去。\r\n老葛于是也不见外，把他自己的情况讲了。他从小也在第三空间长大，父母都给人送货。十五岁的时候考上了军校，后来一直当兵，文化兵，研究雷达，能吃苦，技术又做得不错，赶上机遇又好，居然升到了雷达部门主管，大校军衔。家里没背景不可能再升，就申请转业，到了第一空间一个支持性部门，专给政府企业做后勤保障，组织会议出行，安排各种场面。虽然是蓝领的活儿，但因为涉及的都是政要，又要协调管理，就一直住在第一空间。这种人也不少，厨师、大夫、秘书、管家，都算是高级蓝领了。他们这个机构安排过很多重大场合，老葛现在是主任。老刀知道，老葛说的谦虚，说是蓝领，其实能在第一空间做事的都是牛人，即使厨师也不简单，更何况他从第三空间上来，能管雷达。\r\n“你在这儿睡一会儿。待会儿晚上我带你吃饭去。”老葛说。', '作品中，既有对于原生家庭背景下的欲望缺失与创伤经历，又有对于爱情与理智等不同程度的自我探寻，更有对于科学技术与道德伦理层面的现实发问。']","知识库中未记载相关内容。

参考来源：
- [来源: 10.txt-1]
- [来源: 折叠北京.txt-17]
- [来源: 9.txt-1]",第一空间人口500万，第二空间人口2500万，第三空间人口5000万。,0.5,0.0,0.0
三个空间在48小时的周期内，分别占用多少小时的时间？,"['“这话说着有点冷。”老葛自己也承认，“可就是这么回事。我也不是住在这儿了就说话向着这儿。只是这么多年过来，人就木了，好多事儿没法改变，也只当那么回事了。”\r\n老刀有点明白老葛的意思了，可他不知道该说什么好。\r\n两人都有点醉。他们趁着醉意，聊了不少以前的事，聊小时候吃的东西，学校的打架。老葛最喜欢吃酸辣粉和臭豆腐，在第一空间这么久都吃不到，心里想得痒痒。老葛说起自己的父母，他们还在第三空间，他也不能总回去，每次回去都要打报告申请，实在不太方便。他说第三空间和第一空间之间有官方通道，有不少特殊的人也总是在其中往来。他希望老刀帮他带点东西回去，弥补一下他自己亏欠的心。老刀讲了他孤独的少年时光。\r\n昏黄的灯光中，老刀想起过去。一个人游荡在垃圾场边缘的所有时光。\r\n不知不觉已经是深夜。老葛还要去看一下夜里会场的安置，就又带老刀下楼。楼下还有未结束的舞会末尾，三三两两男女正从舞厅中走出。老葛说企业家大半精力旺盛，经常跳舞到凌晨。散场的舞厅器物凌乱，像女人卸了妆。老葛看着小机器人在狼藉中一一收拾，笑称这是第一空间唯一真实的片刻。\r\n老刀看了看时间，还有三个小时转换。他收拾了一下心情，该走了。\r\n\r\nPART 5\r\n白发演讲人在晚宴之后回到自己的办公室，处理了一些文件，又和欧洲进行了视频通话。十二点感觉疲劳，摘下眼镜揉了揉鼻梁两侧，准备回家。他经常工作到午夜。\r\n电话突然响了，他按下耳机。是秘书。\r\n大会研究组出了状况。之前印好的大会宣言中有一个数据之前计算结果有误，白天突然有人发现。宣言在会议第二天要向世界宣读，因而会议组请示要不要把宣言重新印刷。白发老人当即批准。这是大事，不能有误。他问是谁负责此事，秘书说，是吴闻主任。\r\n他靠在沙发上小睡。清晨四点，电话又响了。印刷有点慢，预计还要一个小时。\r\n他起身望向窗外。夜深人静，漆黑的夜空能看到静谧的猎户座亮星。\r\n猎户座亮星映在镜面般的湖水中。老刀坐在湖水边上，等待转换来临。\r\n他看着夜色中的园林，猜想这可能是自己最后一次看这片风景。他并不忧伤留恋，这里虽然静美，可是和他没关系，他并不钦羡嫉妒。他只是很想记住这段经历。夜里灯光很少，比第三空间遍布的霓虹灯少很多，建筑散发着沉睡的呼吸，幽静安宁。\r\n清晨五点，秘书打电话说，材料印好了，还没出车间，问是否人为推迟转换的时间。\r\n白发老人斩钉截铁地说，废话，当然推迟。', '背后突然有声音，吓了老刀一跳。他转过身，发现公寓里还有一个男生，刚从自己房间里出来。男生面无表情，看到老刀也没有打招呼。他走到阳台旁边一台机器旁边，点了点，机器里传出咔咔刷刷轰轰嚓的声音，一阵香味飘来，男生端出一盘菜又回了房间。从他半开的门缝看过去，男孩坐在地上的被子和袜子中间，瞪着空无一物的墙，一边吃一边咯咯地笑。他不时用手推一推眼镜。吃完把盘子放在脚边，站起身，同样对着空墙做击打动作，费力气顶住某个透明的影子，偶尔来一个背摔，气喘吁吁。\r\n老刀对第二空间最后的记忆是街上撤退时的优雅。从公寓楼的窗口望下去，一切都带着令人羡慕的秩序感。九点十五分开始，街上一间间卖衣服的小店开始关灯，聚餐之后的团体面色红润，相互告别。年轻男女在出租车外亲吻。然后所有人回楼，世界蛰伏。\r\n夜晚十点到了。他回到他的世界，回去上班。\r\n\r\nPART 3\r\n第一和第三空间之间没有连通的垃圾道，第一空间的垃圾经过一道铁闸，运到第三空间之后，铁闸迅速合拢。老刀不喜欢从地表翻越，但他没有办法。\r\n他在呼啸的风中爬过翻转的土地，抓住每一寸零落的金属残渣，找到身体和心理平衡，最后匍匐在离他最遥远的一重世界的土地上。他被整个攀爬弄得头晕脑胀，胃口也不舒服。他忍住呕吐，在地上趴了一会儿。\r\n当他爬起身的时候，天亮了。\r\n老刀从来没有见过这样的景象。太阳缓缓升起，天边是深远而纯净的蓝，蓝色下沿是橙黄色，有斜向上的条状薄云。太阳被一处屋檐遮住，屋檐显得异常黑，屋檐背后明亮夺目。太阳升起时，天的蓝色变浅了，但是更宁静透彻。老刀站起身，向太阳的方向奔跑。他想要抓住那道褪去的金色。蓝天中能看见树枝的剪影。他的心狂跳不已。他从来不知道太阳升起竟然如此动人。\r\n他跑了一段路，停下来，冷静了。他站在街道中央。路的两旁是高大树木和大片草坪。他环视四周，目力所及，远远近近都没有一座高楼。他迷惑了，不确定自己是不是真的到了第一空间。他能看见两排粗壮的银杏。\r\n他又退回几步，看着自己跑来的方向。街边有一个路牌。他打开手机里存的地图，虽然没有第一空间动态图权限，但有事先下载的静态图。他找到了自己的位置和他要去的地方。他刚从一座巨大的园子里奔出来，翻转的地方就在园子的湖边。\r\n老刀在万籁俱寂的街上跑了一公里，很容易找到了要找的小区。他躲在一丛灌木背后，远远地望着那座漂亮的房子。\r\n8:30，依言出来了。', '该小说通过紊乱叙事，解构了技术物化主体的传统叙事']","知识库中未记载相关内容。

参考来源：
- [来源: 折叠北京.txt-22]
- [来源: 折叠北京.txt-11]
- [来源: 10.txt-1]",第一空间从第一天早晨六点到第二天早晨六点（24小时）；第二空间从第二天早晨六点到晚上十点（16小时）；第三空间从第二天晚上十点到第三天早晨六点（8小时）。,0.25,0.0,0.0
老葛为什么反对在第三空间使用全自动化的垃圾处理技术？,"['“这儿的菜不对外，所以都不标价。我也不知道多少钱。”老葛已经开动了筷子，“也就一般吧。估计一两万之间，个别贵一点可能三四万。就那么回事。”\r\n老刀吃了两口就真的觉得饿了。他有抗饥饿的办法，忍上一天不吃东西也可以，身体会有些颤抖发飘，但精神不受影响。直到这时，他才发觉自己的饥饿。他只想快点咀嚼，牙齿的速度赶不上胃口空虚的速度。吃得急了，就喝一口。这白酒很香，不辣。老葛慢悠悠的，微笑着看着他。\r\n“对了，”老刀吃得半饱时，想起刚才的事，“今天那个演讲人是谁？我看着很面熟。”\r\n“也总上电视嘛。”老葛说，“我们的顶头上司。很厉害的老头儿。他可是管实事儿的，城市运作的事儿都归他管。”\r\n“他们今天说起垃圾自动处理的事儿。你说以后会改造吗？”\r\n“这事儿啊，不好说，”老葛砸了口酒，打了个嗝，“我看够呛。关键是，你得知道当初为啥弄人工处理。其实当初的情况就跟欧洲二十世纪末差不多，经济发展，但失业率上升，印钱也不管用，菲利普斯曲线不符合。”\r\n他看老刀一脸茫然，呵呵笑了起来：“算了，这些东西你也不懂。”\r\n他跟老刀碰了碰杯子，两人一齐喝了又斟上。\r\n“反正就说失业吧，这你肯定懂。”老葛接着说，“人工成本往上涨，机器成本往下降，到一定时候就是机器便宜，生产力一改造，升级了，GDP上去了，失业也上去了。怎么办？政策保护？福利？越保护工厂越不雇人。你现在上城外看看，那几公里的厂区就没几个人。农场不也是吗。大农场一搞几千亩地，全设备耕种，根本要不了几个人。咱们当时怎么搞过欧美的，不就是这么规模化搞的吗。但问题是，地都腾出来了，人都省出来了，这些人干嘛去呢。欧洲那边是强行减少每人工作时间，增加就业机会，可是这样没活力你明白吗。最好的办法是彻底减少一些人的生活时间，再给他们找到活儿干。你明白了吧？就是塞到夜里。这样还有一个好处，就是每次通货膨胀几乎传不到底层去，印钞票、花钞票都是能贷款的人消化了，GDP涨了，底下的物价却不涨。人们根本不知道。”\r\n老刀听得似懂非懂，但是老葛的话里有一股凉意，他还是能听出来的。老葛还是嬉笑的腔调，但与其说是嬉笑，倒不如说是不愿意让自己的语气太直白而故意如此。\r\n“这话说着有点冷。”老葛自己也承认，“可就是这么回事。我也不是住在这儿了就说话向着这儿。只是这么多年过来，人就木了，好多事儿没法改变，也只当那么回事了。”', '“这话说着有点冷。”老葛自己也承认，“可就是这么回事。我也不是住在这儿了就说话向着这儿。只是这么多年过来，人就木了，好多事儿没法改变，也只当那么回事了。”\r\n老刀有点明白老葛的意思了，可他不知道该说什么好。\r\n两人都有点醉。他们趁着醉意，聊了不少以前的事，聊小时候吃的东西，学校的打架。老葛最喜欢吃酸辣粉和臭豆腐，在第一空间这么久都吃不到，心里想得痒痒。老葛说起自己的父母，他们还在第三空间，他也不能总回去，每次回去都要打报告申请，实在不太方便。他说第三空间和第一空间之间有官方通道，有不少特殊的人也总是在其中往来。他希望老刀帮他带点东西回去，弥补一下他自己亏欠的心。老刀讲了他孤独的少年时光。\r\n昏黄的灯光中，老刀想起过去。一个人游荡在垃圾场边缘的所有时光。\r\n不知不觉已经是深夜。老葛还要去看一下夜里会场的安置，就又带老刀下楼。楼下还有未结束的舞会末尾，三三两两男女正从舞厅中走出。老葛说企业家大半精力旺盛，经常跳舞到凌晨。散场的舞厅器物凌乱，像女人卸了妆。老葛看着小机器人在狼藉中一一收拾，笑称这是第一空间唯一真实的片刻。\r\n老刀看了看时间，还有三个小时转换。他收拾了一下心情，该走了。\r\n\r\nPART 5\r\n白发演讲人在晚宴之后回到自己的办公室，处理了一些文件，又和欧洲进行了视频通话。十二点感觉疲劳，摘下眼镜揉了揉鼻梁两侧，准备回家。他经常工作到午夜。\r\n电话突然响了，他按下耳机。是秘书。\r\n大会研究组出了状况。之前印好的大会宣言中有一个数据之前计算结果有误，白天突然有人发现。宣言在会议第二天要向世界宣读，因而会议组请示要不要把宣言重新印刷。白发老人当即批准。这是大事，不能有误。他问是谁负责此事，秘书说，是吴闻主任。\r\n他靠在沙发上小睡。清晨四点，电话又响了。印刷有点慢，预计还要一个小时。\r\n他起身望向窗外。夜深人静，漆黑的夜空能看到静谧的猎户座亮星。\r\n猎户座亮星映在镜面般的湖水中。老刀坐在湖水边上，等待转换来临。\r\n他看着夜色中的园林，猜想这可能是自己最后一次看这片风景。他并不忧伤留恋，这里虽然静美，可是和他没关系，他并不钦羡嫉妒。他只是很想记住这段经历。夜里灯光很少，比第三空间遍布的霓虹灯少很多，建筑散发着沉睡的呼吸，幽静安宁。\r\n清晨五点，秘书打电话说，材料印好了，还没出车间，问是否人为推迟转换的时间。\r\n白发老人斩钉截铁地说，废话，当然推迟。', '老刀叹了一口气，横下一条心，觉得事到如今，只好认命。\r\n年长者带他进入一个房间。他发现这是一个旅馆房间，非常大，比秦天的公寓客厅还大，似乎有自己租的房子两倍大。房间的色调是暗沉的金褐色，一张极宽大的双人床摆在中央。床头背后的墙面上是颜色过渡的抽象图案，落地窗，白色半透明纱帘，窗前是一个小圆桌和两张沙发。他心里惴惴。不知道年长者的身份和态度。\r\n“坐吧，坐吧。”年长者拍拍他肩膀，笑笑，“没事了。”\r\n老刀狐疑地看着他。\r\n“你是第三空间来的吧？”年长者把他拉到沙发边上，伸手示意。\r\n“您怎么知道？”老刀无法撒谎。\r\n“从你裤子上。”年长者用手指指他的裤腰，“你那商标还没剪呢。这牌子只有第三空间有卖的。我小时候我妈就喜欢给我爸买这牌子。”\r\n“您是……”\r\n“别您您的，叫你吧。我估摸着我也比你大不了几岁。你今年多大？我五十二。……你看看，就比你大四岁。”他顿了一下，又说，“我叫葛大平，你叫我老葛吧。”\r\n老刀放松了些。老葛把西装脱了，活动了一下膀子，从墙壁里接了一杯热水，递给老刀。他长长的脸，眼角眉梢和两颊都有些下坠，戴一副眼镜，也向下耷拉着，头发有点自来卷，蓬松地堆在头顶，说起话来眉毛一跳一跳，很有喜剧效果。他自己泡了点茶，问老刀要不要，老刀摇摇头。\r\n“我原来也是第三空间的。咱也算半个老乡吧。”老葛说，“所以不用太拘束。我还是能管点事儿，不会把你送出去的。”\r\n老刀长长地出了口气，心里感叹万幸。他于是把自己到第二、第一空间的始末讲了一遍，略去依言感情的细节，只说送到了信，就等着回去。\r\n老葛于是也不见外，把他自己的情况讲了。他从小也在第三空间长大，父母都给人送货。十五岁的时候考上了军校，后来一直当兵，文化兵，研究雷达，能吃苦，技术又做得不错，赶上机遇又好，居然升到了雷达部门主管，大校军衔。家里没背景不可能再升，就申请转业，到了第一空间一个支持性部门，专给政府企业做后勤保障，组织会议出行，安排各种场面。虽然是蓝领的活儿，但因为涉及的都是政要，又要协调管理，就一直住在第一空间。这种人也不少，厨师、大夫、秘书、管家，都算是高级蓝领了。他们这个机构安排过很多重大场合，老葛现在是主任。老刀知道，老葛说的谦虚，说是蓝领，其实能在第一空间做事的都是牛人，即使厨师也不简单，更何况他从第三空间上来，能管雷达。\r\n“你在这儿睡一会儿。待会儿晚上我带你吃饭去。”老葛说。']",老葛反对在第三空间使用全自动化的垃圾处理技术，是因为他认为自动化会导致失业率上升——人工成本上涨而机器成本下降，当机器更便宜时，生产力升级、GDP上升的同时，失业也会随之上升；而当时设计人工处理垃圾的初衷，正是为了吸纳过剩劳动力，缓解失业问题。他指出，若改用自动化，“地都腾出来了，人都省出来了，这些人干嘛去呢”，并强调欧洲式减少工时的做法“没活力”，而“彻底减少一些人的生活时间，再给他们找到活儿干”（即通过空间折叠将部分人口置于夜间休眠状态）才是现实选择 [来源: 折叠北京.txt-21]。,因为老葛认为自动化技术会取代人工分拣，导致第三空间数千万依赖此维持生计的垃圾工彻底失业，失去生存来源。,,0.5490340009574427,0.9999999999
文中提到的‘折叠’动作通常在什么时间点发生？,"['==========================================================\r\n北京折叠\r\n作者：郝景芳\r\n内容简介\r\n 在《北京折叠》中，作者构建了一个存在三个空间的北京。 三个空间生活着不同社会分工的人，通过技术手段，城市会在一定时间折叠起某个空间，展现不同的生活面貌。 \r\n\r\n==========================================================\r\n作者简介\r\n<b>郝景芳</b>，天津人，小说作者，散文作者。\r\n2002年荣获全国中学生第四届新概念作文大赛一等奖。\r\n2006年，毕业于清华大学物理系，2006-2008年就读于清华大学天体物理中心，现为清华大学经管学院在读博士生。\r\n以《谷神的飞翔》荣获2007年首届九州奖暨第二届“原创之星”征文大赛一等奖，又以《祖母家的夏天》荣获2007年《科幻世界》科幻小说银河奖读者提名奖。\r\n2016年4月27日，小说《北京折叠》获第74届雨果奖最佳“短中篇小说”提名。2016年8月，郝景芳的小说《北京折叠》获得第74届雨果奖。\r\n\r\nPART 1\r\n清晨4:50，老刀穿过熙熙攘攘的步行街，去找彭蠡。\r\n从垃圾站下班之后，老刀回家洗了个澡，换了衣服。白色衬衫和褐色裤子，这是他唯一一套体面衣服，衬衫袖口磨了边，他把袖子卷到胳膊肘。老刀四十八岁，没结婚，已经过了注意外表的年龄，又没人照顾起居，这一套衣服留着穿了很多年，每次穿一天，回家就脱了叠上。他在垃圾站上班，没必要穿得体面，偶尔参加谁家小孩的婚礼，才拿出来穿在身上。这一次他不想脏兮兮地见陌生人。他在垃圾站连续工作了五小时，很担心身上会有味道。\r\n步行街上挤满了刚刚下班的人。拥挤的男人女人围着小摊子挑土特产，大声讨价还价。食客围着塑料桌子，埋头在酸辣粉的热气腾腾中，饿虎扑食一般，白色蒸汽遮住了脸。油炸的香味弥漫。货摊上的酸枣和核桃堆成山，腊肉在头顶摇摆。这个点是全天最热闹的时间，基本都收工了，忙碌了几个小时的人们都赶过来吃一顿饱饭，人声鼎沸。\r\n老刀艰难地穿过人群。端盘子的伙计一边喊着让让一边推开挡道的人，开出一条路来，老刀跟在后面。\r\n彭蠡家在小街深处。老刀上楼，彭蠡不在家。问邻居，邻居说他每天快到关门才回来，具体几点不清楚。\r\n老刀有点担忧，看了看手表，清晨5点。', '清晨五点，秘书打电话说，材料印好了，还没出车间，问是否人为推迟转换的时间。\r\n白发老人斩钉截铁地说，废话，当然推迟。\r\n清晨五点四十分，印刷品抵达会场，但还需要分装在三千个会议夹子中。\r\n老刀看到了依稀的晨光，这个季节六点还没有天亮，但已经能看到蒙蒙曙光。\r\n他做好了一切准备，反复看手机上的时间。有一点奇怪，已经只有一两分钟到六点了，还是没有任何动静。他猜想也许第一空间的转换更平稳顺滑。\r\n清晨六点十分，分装结束。\r\n白发老人松了一口气，下令转换开始。\r\n老刀发现地面终于动了，他站起身，活动了一下有点麻木的手脚，小心翼翼来到边缘。土地的缝隙开始拉大，缝隙两边同时向上掀起。他沿着其中一边往截面上移动，背身挪移，先用脚试探着，手扶住地面退行。大地开始翻转。\r\n六点二十分，秘书打来紧急电话，说吴闻主任不小心将存着重要文件的数据key遗忘在会场，担心会被机器人清理，需要立即取回。\r\n白发老人有点恼怒，但也只好令转换停止，恢复原状。\r\n老刀在截面上正慢慢挪移，忽然感觉土地的移动停止了，接着开始调转方向，已错开的土地开始合拢。他吓了一跳，连忙向回攀爬。他害怕滚落，手脚并用，异常小心。\r\n土地回归的速度比他想象的快，就在他爬到地表的时候，土地合拢了，他的一条小腿被两块土地夹在中间，尽管是泥土，不足以切筋断骨，但力量十足，他试了几次也无法脱出。他心里大叫糟糕，头顶因为焦急和疼痛渗出汗水。他不知道是否被人发现了。\r\n老刀趴在地上，静听着周围的声音。他似乎听到匆匆接近的脚步声。他想象着很快就有警察过来，将他抓起来，夹住的小腿会被砍断，带着疮口扔到监牢里。他不知道自己是什么时候暴露了身份。他伏在青草覆盖的泥土上，感觉到晨露的冰凉。湿气从领口和袖口透入他的身体，让他觉得清醒，却又忍不住战栗。他默数着时间，期盼这只是技术故障。他设想着自己如果被抓住了该说些什么。也许他该交待自己二十八年工作的勤恳诚实，赚一点同情分。他不知道自己会不会被审判。命运在前方逼人不已。', '霓虹灯亮了，商铺顶端闪烁的小灯打出新疆大枣、东北拉皮、上海烤麸和湖南腊肉。\r\n整整一天，老刀头脑中都忘不了这一幕。他在这里生活了四十八年，还从来没有见过这一切。他的日子总是从胶囊起，至胶囊终，在脏兮兮的餐桌和被争吵萦绕的货摊之间穿行。这是他第一次看到世界纯粹的模样。\r\n每个清晨，如果有人从远处观望——就像大货车司机在高速北京入口处等待时那样——他会看到整座城市的伸展与折叠。\r\n清晨六点，司机们总会走下车，站在高速边上，揉着经过一夜潦草睡眠而昏沉的眼睛，打着哈欠，相互指点着望向远处的城市中央。高速截断在七环之外，所有的翻转都在六环内发生。不远不近的距离，就像遥望西山或是海上的一座孤岛。\r\n晨光熹微中，一座城市折叠自身，向地面收拢。高楼像最卑微的仆人，弯下腰，让自己低声下气切断身体，头碰着脚，紧紧贴在一起，然后再次断裂弯腰，将头顶手臂扭曲弯折，插入空隙。高楼弯折之后重新组合，蜷缩成致密的巨大魔方，密密匝匝地聚合到一起，陷入沉睡。然后地面翻转，小块小块土地围绕其轴，一百八十度翻转到另一面，将另一面的建筑楼宇露出地表。楼宇由折叠中站立起身，在灰蓝色的天空中像苏醒的兽类。城市孤岛在橘黄色晨光中落位，展开，站定，腾起弥漫的灰色苍云。\r\n司机们就在困倦与饥饿中欣赏这一幕无穷循环的城市戏剧。\r\n\r\nPART 2\r\n折叠城市分三层空间。大地的一面是第一空间，五百万人口，生存时间是从清晨六点到第二天清晨六点。空间休眠，大地翻转。翻转后的另一面是第二空间和第三空间。第二空间生活着两千五百万人口，从次日清晨六点到夜晚十点，第三空间生活着五千万人，从十点到清晨六点，然后回到第一空间。时间经过了精心规划和最优分配，小心翼翼隔离，五百万人享用二十四小时，七千五百万人享用另外二十四小时。\r\n大地的两侧重量并不均衡，为了平衡这种不均，第一空间的土地更厚，土壤里埋藏配重物质。人口和建筑的失衡用土地来换。第一空间居民也因而认为自身的底蕴更厚。\r\n老刀从小生活在第三空间。他知道自己的日子是什么样，不用彭蠡说他也知道。他是个垃圾工，做了二十八年垃圾工，在可预见的未来还将一直做下去。他还没找到可以独自生存的意义和最后的怀疑主义。他仍然在卑微生活的间隙占据一席。']",文中提到的“折叠”动作通常在清晨六点发生。原文明确写道：“清晨六点，司机们总会走下车……晨光熹微中，一座城市折叠自身，向地面收拢。”同时，第一空间的生存时间是从“清晨六点到第二天清晨六点”，空间休眠时大地翻转，翻转后另一面呈现第二、三空间；而老刀在清晨六点十分观察到“分装结束”，随后“白发老人松了一口气，下令转换开始”，紧接着“老刀发现地面终于动了”，表明折叠动作始于清晨六点左右，并于六点十分正式启动 [来源: 折叠北京.txt-6]；另有一处佐证：“清晨六点十分，分装结束。白发老人松了一口气，下令转换开始。”[来源: 折叠北京.txt-23]。,折叠通常在空间转换的时间节点发生，例如清晨六点，整座城市会进行翻转和折叠。,0.2727272727272727,0.9405004944955273,0.5833333333041666
老陆（第一空间）对垃圾处理的看法与老葛有什么本质不同？,"['“这儿的菜不对外，所以都不标价。我也不知道多少钱。”老葛已经开动了筷子，“也就一般吧。估计一两万之间，个别贵一点可能三四万。就那么回事。”\r\n老刀吃了两口就真的觉得饿了。他有抗饥饿的办法，忍上一天不吃东西也可以，身体会有些颤抖发飘，但精神不受影响。直到这时，他才发觉自己的饥饿。他只想快点咀嚼，牙齿的速度赶不上胃口空虚的速度。吃得急了，就喝一口。这白酒很香，不辣。老葛慢悠悠的，微笑着看着他。\r\n“对了，”老刀吃得半饱时，想起刚才的事，“今天那个演讲人是谁？我看着很面熟。”\r\n“也总上电视嘛。”老葛说，“我们的顶头上司。很厉害的老头儿。他可是管实事儿的，城市运作的事儿都归他管。”\r\n“他们今天说起垃圾自动处理的事儿。你说以后会改造吗？”\r\n“这事儿啊，不好说，”老葛砸了口酒，打了个嗝，“我看够呛。关键是，你得知道当初为啥弄人工处理。其实当初的情况就跟欧洲二十世纪末差不多，经济发展，但失业率上升，印钱也不管用，菲利普斯曲线不符合。”\r\n他看老刀一脸茫然，呵呵笑了起来：“算了，这些东西你也不懂。”\r\n他跟老刀碰了碰杯子，两人一齐喝了又斟上。\r\n“反正就说失业吧，这你肯定懂。”老葛接着说，“人工成本往上涨，机器成本往下降，到一定时候就是机器便宜，生产力一改造，升级了，GDP上去了，失业也上去了。怎么办？政策保护？福利？越保护工厂越不雇人。你现在上城外看看，那几公里的厂区就没几个人。农场不也是吗。大农场一搞几千亩地，全设备耕种，根本要不了几个人。咱们当时怎么搞过欧美的，不就是这么规模化搞的吗。但问题是，地都腾出来了，人都省出来了，这些人干嘛去呢。欧洲那边是强行减少每人工作时间，增加就业机会，可是这样没活力你明白吗。最好的办法是彻底减少一些人的生活时间，再给他们找到活儿干。你明白了吧？就是塞到夜里。这样还有一个好处，就是每次通货膨胀几乎传不到底层去，印钞票、花钞票都是能贷款的人消化了，GDP涨了，底下的物价却不涨。人们根本不知道。”\r\n老刀听得似懂非懂，但是老葛的话里有一股凉意，他还是能听出来的。老葛还是嬉笑的腔调，但与其说是嬉笑，倒不如说是不愿意让自己的语气太直白而故意如此。\r\n“这话说着有点冷。”老葛自己也承认，“可就是这么回事。我也不是住在这儿了就说话向着这儿。只是这么多年过来，人就木了，好多事儿没法改变，也只当那么回事了。”', '“这话说着有点冷。”老葛自己也承认，“可就是这么回事。我也不是住在这儿了就说话向着这儿。只是这么多年过来，人就木了，好多事儿没法改变，也只当那么回事了。”\r\n老刀有点明白老葛的意思了，可他不知道该说什么好。\r\n两人都有点醉。他们趁着醉意，聊了不少以前的事，聊小时候吃的东西，学校的打架。老葛最喜欢吃酸辣粉和臭豆腐，在第一空间这么久都吃不到，心里想得痒痒。老葛说起自己的父母，他们还在第三空间，他也不能总回去，每次回去都要打报告申请，实在不太方便。他说第三空间和第一空间之间有官方通道，有不少特殊的人也总是在其中往来。他希望老刀帮他带点东西回去，弥补一下他自己亏欠的心。老刀讲了他孤独的少年时光。\r\n昏黄的灯光中，老刀想起过去。一个人游荡在垃圾场边缘的所有时光。\r\n不知不觉已经是深夜。老葛还要去看一下夜里会场的安置，就又带老刀下楼。楼下还有未结束的舞会末尾，三三两两男女正从舞厅中走出。老葛说企业家大半精力旺盛，经常跳舞到凌晨。散场的舞厅器物凌乱，像女人卸了妆。老葛看着小机器人在狼藉中一一收拾，笑称这是第一空间唯一真实的片刻。\r\n老刀看了看时间，还有三个小时转换。他收拾了一下心情，该走了。\r\n\r\nPART 5\r\n白发演讲人在晚宴之后回到自己的办公室，处理了一些文件，又和欧洲进行了视频通话。十二点感觉疲劳，摘下眼镜揉了揉鼻梁两侧，准备回家。他经常工作到午夜。\r\n电话突然响了，他按下耳机。是秘书。\r\n大会研究组出了状况。之前印好的大会宣言中有一个数据之前计算结果有误，白天突然有人发现。宣言在会议第二天要向世界宣读，因而会议组请示要不要把宣言重新印刷。白发老人当即批准。这是大事，不能有误。他问是谁负责此事，秘书说，是吴闻主任。\r\n他靠在沙发上小睡。清晨四点，电话又响了。印刷有点慢，预计还要一个小时。\r\n他起身望向窗外。夜深人静，漆黑的夜空能看到静谧的猎户座亮星。\r\n猎户座亮星映在镜面般的湖水中。老刀坐在湖水边上，等待转换来临。\r\n他看着夜色中的园林，猜想这可能是自己最后一次看这片风景。他并不忧伤留恋，这里虽然静美，可是和他没关系，他并不钦羡嫉妒。他只是很想记住这段经历。夜里灯光很少，比第三空间遍布的霓虹灯少很多，建筑散发着沉睡的呼吸，幽静安宁。\r\n清晨五点，秘书打电话说，材料印好了，还没出车间，问是否人为推迟转换的时间。\r\n白发老人斩钉截铁地说，废话，当然推迟。', '老刀叹了一口气，横下一条心，觉得事到如今，只好认命。\r\n年长者带他进入一个房间。他发现这是一个旅馆房间，非常大，比秦天的公寓客厅还大，似乎有自己租的房子两倍大。房间的色调是暗沉的金褐色，一张极宽大的双人床摆在中央。床头背后的墙面上是颜色过渡的抽象图案，落地窗，白色半透明纱帘，窗前是一个小圆桌和两张沙发。他心里惴惴。不知道年长者的身份和态度。\r\n“坐吧，坐吧。”年长者拍拍他肩膀，笑笑，“没事了。”\r\n老刀狐疑地看着他。\r\n“你是第三空间来的吧？”年长者把他拉到沙发边上，伸手示意。\r\n“您怎么知道？”老刀无法撒谎。\r\n“从你裤子上。”年长者用手指指他的裤腰，“你那商标还没剪呢。这牌子只有第三空间有卖的。我小时候我妈就喜欢给我爸买这牌子。”\r\n“您是……”\r\n“别您您的，叫你吧。我估摸着我也比你大不了几岁。你今年多大？我五十二。……你看看，就比你大四岁。”他顿了一下，又说，“我叫葛大平，你叫我老葛吧。”\r\n老刀放松了些。老葛把西装脱了，活动了一下膀子，从墙壁里接了一杯热水，递给老刀。他长长的脸，眼角眉梢和两颊都有些下坠，戴一副眼镜，也向下耷拉着，头发有点自来卷，蓬松地堆在头顶，说起话来眉毛一跳一跳，很有喜剧效果。他自己泡了点茶，问老刀要不要，老刀摇摇头。\r\n“我原来也是第三空间的。咱也算半个老乡吧。”老葛说，“所以不用太拘束。我还是能管点事儿，不会把你送出去的。”\r\n老刀长长地出了口气，心里感叹万幸。他于是把自己到第二、第一空间的始末讲了一遍，略去依言感情的细节，只说送到了信，就等着回去。\r\n老葛于是也不见外，把他自己的情况讲了。他从小也在第三空间长大，父母都给人送货。十五岁的时候考上了军校，后来一直当兵，文化兵，研究雷达，能吃苦，技术又做得不错，赶上机遇又好，居然升到了雷达部门主管，大校军衔。家里没背景不可能再升，就申请转业，到了第一空间一个支持性部门，专给政府企业做后勤保障，组织会议出行，安排各种场面。虽然是蓝领的活儿，但因为涉及的都是政要，又要协调管理，就一直住在第一空间。这种人也不少，厨师、大夫、秘书、管家，都算是高级蓝领了。他们这个机构安排过很多重大场合，老葛现在是主任。老刀知道，老葛说的谦虚，说是蓝领，其实能在第一空间做事的都是牛人，即使厨师也不简单，更何况他从第三空间上来，能管雷达。\r\n“你在这儿睡一会儿。待会儿晚上我带你吃饭去。”老葛说。']","知识库中未记载“老陆（第一空间）”这一人物及其对垃圾处理的看法。【已知信息】中仅出现“老葛”（第一空间居民，原第三空间出身，现任会议后勤保障部门主任），并未提及名为“老陆”的角色，亦无任何关于“老陆”的言行、身份或观点的描述。

因此，无法比较“老陆”与老葛在垃圾处理问题上的看法差异。

答案：知识库中未记载相关内容。

参考来源：
- [来源: 折叠北京.txt-21]
- [来源: 折叠北京.txt-22]
- [来源: 折叠北京.txt-17]",老陆从能源转化和宏观成本角度看，认为技术升级是必然；老葛从社会底层生存角度看，认为技术升级是对穷人生存权的剥夺。,0.8333333333333334,0.0,0.0
根据文档，第一空间的人是否知道第三空间的人的存在？,"['老刀叹了一口气，横下一条心，觉得事到如今，只好认命。\r\n年长者带他进入一个房间。他发现这是一个旅馆房间，非常大，比秦天的公寓客厅还大，似乎有自己租的房子两倍大。房间的色调是暗沉的金褐色，一张极宽大的双人床摆在中央。床头背后的墙面上是颜色过渡的抽象图案，落地窗，白色半透明纱帘，窗前是一个小圆桌和两张沙发。他心里惴惴。不知道年长者的身份和态度。\r\n“坐吧，坐吧。”年长者拍拍他肩膀，笑笑，“没事了。”\r\n老刀狐疑地看着他。\r\n“你是第三空间来的吧？”年长者把他拉到沙发边上，伸手示意。\r\n“您怎么知道？”老刀无法撒谎。\r\n“从你裤子上。”年长者用手指指他的裤腰，“你那商标还没剪呢。这牌子只有第三空间有卖的。我小时候我妈就喜欢给我爸买这牌子。”\r\n“您是……”\r\n“别您您的，叫你吧。我估摸着我也比你大不了几岁。你今年多大？我五十二。……你看看，就比你大四岁。”他顿了一下，又说，“我叫葛大平，你叫我老葛吧。”\r\n老刀放松了些。老葛把西装脱了，活动了一下膀子，从墙壁里接了一杯热水，递给老刀。他长长的脸，眼角眉梢和两颊都有些下坠，戴一副眼镜，也向下耷拉着，头发有点自来卷，蓬松地堆在头顶，说起话来眉毛一跳一跳，很有喜剧效果。他自己泡了点茶，问老刀要不要，老刀摇摇头。\r\n“我原来也是第三空间的。咱也算半个老乡吧。”老葛说，“所以不用太拘束。我还是能管点事儿，不会把你送出去的。”\r\n老刀长长地出了口气，心里感叹万幸。他于是把自己到第二、第一空间的始末讲了一遍，略去依言感情的细节，只说送到了信，就等着回去。\r\n老葛于是也不见外，把他自己的情况讲了。他从小也在第三空间长大，父母都给人送货。十五岁的时候考上了军校，后来一直当兵，文化兵，研究雷达，能吃苦，技术又做得不错，赶上机遇又好，居然升到了雷达部门主管，大校军衔。家里没背景不可能再升，就申请转业，到了第一空间一个支持性部门，专给政府企业做后勤保障，组织会议出行，安排各种场面。虽然是蓝领的活儿，但因为涉及的都是政要，又要协调管理，就一直住在第一空间。这种人也不少，厨师、大夫、秘书、管家，都算是高级蓝领了。他们这个机构安排过很多重大场合，老葛现在是主任。老刀知道，老葛说的谦虚，说是蓝领，其实能在第一空间做事的都是牛人，即使厨师也不简单，更何况他从第三空间上来，能管雷达。\r\n“你在这儿睡一会儿。待会儿晚上我带你吃饭去。”老葛说。', '背后突然有声音，吓了老刀一跳。他转过身，发现公寓里还有一个男生，刚从自己房间里出来。男生面无表情，看到老刀也没有打招呼。他走到阳台旁边一台机器旁边，点了点，机器里传出咔咔刷刷轰轰嚓的声音，一阵香味飘来，男生端出一盘菜又回了房间。从他半开的门缝看过去，男孩坐在地上的被子和袜子中间，瞪着空无一物的墙，一边吃一边咯咯地笑。他不时用手推一推眼镜。吃完把盘子放在脚边，站起身，同样对着空墙做击打动作，费力气顶住某个透明的影子，偶尔来一个背摔，气喘吁吁。\r\n老刀对第二空间最后的记忆是街上撤退时的优雅。从公寓楼的窗口望下去，一切都带着令人羡慕的秩序感。九点十五分开始，街上一间间卖衣服的小店开始关灯，聚餐之后的团体面色红润，相互告别。年轻男女在出租车外亲吻。然后所有人回楼，世界蛰伏。\r\n夜晚十点到了。他回到他的世界，回去上班。\r\n\r\nPART 3\r\n第一和第三空间之间没有连通的垃圾道，第一空间的垃圾经过一道铁闸，运到第三空间之后，铁闸迅速合拢。老刀不喜欢从地表翻越，但他没有办法。\r\n他在呼啸的风中爬过翻转的土地，抓住每一寸零落的金属残渣，找到身体和心理平衡，最后匍匐在离他最遥远的一重世界的土地上。他被整个攀爬弄得头晕脑胀，胃口也不舒服。他忍住呕吐，在地上趴了一会儿。\r\n当他爬起身的时候，天亮了。\r\n老刀从来没有见过这样的景象。太阳缓缓升起，天边是深远而纯净的蓝，蓝色下沿是橙黄色，有斜向上的条状薄云。太阳被一处屋檐遮住，屋檐显得异常黑，屋檐背后明亮夺目。太阳升起时，天的蓝色变浅了，但是更宁静透彻。老刀站起身，向太阳的方向奔跑。他想要抓住那道褪去的金色。蓝天中能看见树枝的剪影。他的心狂跳不已。他从来不知道太阳升起竟然如此动人。\r\n他跑了一段路，停下来，冷静了。他站在街道中央。路的两旁是高大树木和大片草坪。他环视四周，目力所及，远远近近都没有一座高楼。他迷惑了，不确定自己是不是真的到了第一空间。他能看见两排粗壮的银杏。\r\n他又退回几步，看着自己跑来的方向。街边有一个路牌。他打开手机里存的地图，虽然没有第一空间动态图权限，但有事先下载的静态图。他找到了自己的位置和他要去的地方。他刚从一座巨大的园子里奔出来，翻转的地方就在园子的湖边。\r\n老刀在万籁俱寂的街上跑了一公里，很容易找到了要找的小区。他躲在一丛灌木背后，远远地望着那座漂亮的房子。\r\n8:30，依言出来了。', '“这话说着有点冷。”老葛自己也承认，“可就是这么回事。我也不是住在这儿了就说话向着这儿。只是这么多年过来，人就木了，好多事儿没法改变，也只当那么回事了。”\r\n老刀有点明白老葛的意思了，可他不知道该说什么好。\r\n两人都有点醉。他们趁着醉意，聊了不少以前的事，聊小时候吃的东西，学校的打架。老葛最喜欢吃酸辣粉和臭豆腐，在第一空间这么久都吃不到，心里想得痒痒。老葛说起自己的父母，他们还在第三空间，他也不能总回去，每次回去都要打报告申请，实在不太方便。他说第三空间和第一空间之间有官方通道，有不少特殊的人也总是在其中往来。他希望老刀帮他带点东西回去，弥补一下他自己亏欠的心。老刀讲了他孤独的少年时光。\r\n昏黄的灯光中，老刀想起过去。一个人游荡在垃圾场边缘的所有时光。\r\n不知不觉已经是深夜。老葛还要去看一下夜里会场的安置，就又带老刀下楼。楼下还有未结束的舞会末尾，三三两两男女正从舞厅中走出。老葛说企业家大半精力旺盛，经常跳舞到凌晨。散场的舞厅器物凌乱，像女人卸了妆。老葛看着小机器人在狼藉中一一收拾，笑称这是第一空间唯一真实的片刻。\r\n老刀看了看时间，还有三个小时转换。他收拾了一下心情，该走了。\r\n\r\nPART 5\r\n白发演讲人在晚宴之后回到自己的办公室，处理了一些文件，又和欧洲进行了视频通话。十二点感觉疲劳，摘下眼镜揉了揉鼻梁两侧，准备回家。他经常工作到午夜。\r\n电话突然响了，他按下耳机。是秘书。\r\n大会研究组出了状况。之前印好的大会宣言中有一个数据之前计算结果有误，白天突然有人发现。宣言在会议第二天要向世界宣读，因而会议组请示要不要把宣言重新印刷。白发老人当即批准。这是大事，不能有误。他问是谁负责此事，秘书说，是吴闻主任。\r\n他靠在沙发上小睡。清晨四点，电话又响了。印刷有点慢，预计还要一个小时。\r\n他起身望向窗外。夜深人静，漆黑的夜空能看到静谧的猎户座亮星。\r\n猎户座亮星映在镜面般的湖水中。老刀坐在湖水边上，等待转换来临。\r\n他看着夜色中的园林，猜想这可能是自己最后一次看这片风景。他并不忧伤留恋，这里虽然静美，可是和他没关系，他并不钦羡嫉妒。他只是很想记住这段经历。夜里灯光很少，比第三空间遍布的霓虹灯少很多，建筑散发着沉睡的呼吸，幽静安宁。\r\n清晨五点，秘书打电话说，材料印好了，还没出车间，问是否人为推迟转换的时间。\r\n白发老人斩钉截铁地说，废话，当然推迟。']","是的，第一空间的人知道第三空间的人的存在。  
文中老葛（第一空间居民，原第三空间出身）明确告诉老刀：“你是第三空间来的吧？”并解释自己是从老刀裤子上的商标判断出来的，还提到“这牌子只有第三空间有卖的”，并称“我小时候我妈就喜欢给我爸买这牌子”[来源: 折叠北京.txt-17]。这表明第一空间居民不仅知晓第三空间的存在，且对第三空间的消费特征、生活细节有一定了解。  
此外，老葛还指出“第三空间和第一空间之间有官方通道，有不少特殊的人也总是在其中往来”[来源: 折叠北京.txt-22]，进一步佐证第一空间高层或相关人员对第三空间具有制度性认知与实际接触渠道。  

因此，第一空间的人确知第三空间的人存在。",是的，第一空间的人知道，但他们通常选择忽视，或者将其视为维持城市运转的必要‘底层细节’。,1.0,0.8640219145671884,0.0
